{
  "record_version": 1,
  "delta_id": "local-first-account-safety-v015",
  "release": "2026-07-15-local-first-account-safety",
  "operation": "protocol_migration",
  "source": {
    "ref": "release-wt/2026-07-15-local-first-account-safety",
    "commit_oid": "de7e65b9735d8e4b2da1951f7356989f38987c21",
    "board_blob_oid": "5b27cf6b38fe9a28b9c4058e09360d7038054f25",
    "contracts_blob_oid": "e4f25c1d2cd750c0219835d3316107294e5adf8a",
    "protocol_blob_oid": null
  },
  "ratification": {
    "ratified_by": "Brad (Coach)",
    "ratified_at": "2026-07-16T00:09:16+10:00",
    "tracking": "sworn#121",
    "decision_digest": "sha256:47d8eb4439e8db4c99997e48d30948bfc1e8a24ca8257aa24305227032a4d01b"
  },
  "owner_seeds": [],
  "mutations": [
    {
      "path": "docs/release/2026-07-15-local-first-account-safety/S01-versioned-local-records/spec.json",
      "kind": "replace",
      "before_blob_oid": "f4ab16d809a2cd30d7909df94ca224e8acbe7893",
      "after_utf8_base64": "ewogICIkc2NoZW1hIjogImh0dHBzOi8vYmF0b24uc2F3eTNyLm5ldC9zY2hlbWFzL3NwZWMtdjEuanNvbiIsCiAgInNsaWNlX2lkIjogIlMwMS12ZXJzaW9uZWQtbG9jYWwtcmVjb3JkcyIsCiAgInJlbGVhc2UiOiAiMjAyNi0wNy0xNS1sb2NhbC1maXJzdC1hY2NvdW50LXNhZmV0eSIsCiAgInRyYWNrIjogIlQxLWxvY2FsLWFjY291bnQtYm91bmRhcnkiLAogICJ1c2VyX291dGNvbWUiOiAiQSBTd29ybkFnZW50IHVzZXIgdXBncmFkZXMgZnJvbSB0aGUgc2hhcmVkIGNyZWRlbnRpYWwgZW52ZWxvcGUgd2l0aG91dCBsb3NpbmcgcHJvdmlkZXIga2V5czsgYW4gdW51c2VkIGlzc3Vlci1sZXNzIGxlZ2FjeSBzZXNzaW9uIGlzIHNhZmVseSByZW1vdmVkLCBhbmQgb25seSBhIGZyZXNoIGlzc3Vlci1ib3VuZCBsb2dpbiBjYW4gY3JlYXRlIGFjY291bnQgc3RhdGUuIiwKICAicmF0aW9uYWxlIjogIlRoZSBjdXJyZW50IGZpZWxkLXByZXNlcnZpbmcgZW52ZWxvcGUgY29udGFpbnMgdW5yZWxhdGVkIHNlY3JldHMgdW5kZXIgb25lIHVudmVyc2lvbmVkIGNvcnJ1cHRpb24gYW5kIGxvZ291dCBib3VuZGFyeS4gVGhpcyBzbGljZSBvd25zIEMtMDEgYW5kIHRoZSBzdG9yYWdlIGJvdW5kYXJ5IGZvciBDLTAyLCBwcmVzZXJ2ZXMgdGhlIHByb3ZpZGVyIGZpbGUgcGF0aCBmb3IgY29tcGF0aWJpbGl0eSwgYW5kIG1ha2VzIHRoZSBzcGxpdCBjb252ZXJnZSB0aHJvdWdoIGEgdmVyaWZpZWQgcHJvdmlkZXIgcmV3cml0ZSB3aXRob3V0IGd1ZXNzaW5nIGF1dGhvcml0eSBmb3IgYW4gaXNzdWVyLWxlc3MgYmVhcmVyIHRva2VuLiIsCiAgInRvdWNocG9pbnRzIjogWwogICAgImludGVybmFsL2NyZWRlbnRpYWxzL3N0b3JlLmdvIiwKICAgICJpbnRlcm5hbC9jcmVkZW50aWFscy9zdG9yZV90ZXN0LmdvIiwKICAgICJpbnRlcm5hbC9tb2RlbC9jcmVkZW50aWFscy5nbyIsCiAgICAiaW50ZXJuYWwvbW9kZWwvY3JlZGVudGlhbHNfdGVzdC5nbyIsCiAgICAiaW50ZXJuYWwvYWNjb3VudC9hY2NvdW50LmdvIiwKICAgICJpbnRlcm5hbC9hY2NvdW50L2FjY291bnRfdGVzdC5nbyIsCiAgICAiY21kL3N3b3JuL2NyZWRlbnRpYWxzX2ludGVncmF0aW9uX3Rlc3QuZ28iLAogICAgImNtZC9zd29ybi9kb2N0b3IuZ28iLAogICAgImNtZC9zd29ybi9kb2N0b3JfdGVzdC5nbyIsCiAgICAiY21kL3N3b3JuL2luaXQuZ28iLAogICAgImNtZC9zd29ybi9pbml0X3Rlc3QuZ28iCiAgXSwKICAiaW5fc2NvcGUiOiBbCiAgICAiRGVmaW5lIGFuZCB2YWxpZGF0ZSBwcm92aWRlci1jcmVkZW50aWFscy12MSBhdCB0aGUgZXhpc3RpbmcgY3JlZGVudGlhbHMuanNvbiBwYXRoIGFuZCBhY2NvdW50LXNlc3Npb24tdjEgYXQgYWNjb3VudC5qc29uLCBlYWNoIHdyaXR0ZW4gMDYwMCBpbnNpZGUgYSAwNzAwIGNvbmZpZ3VyYXRpb24gZGlyZWN0b3J5LiIsCiAgICAiUmVwbGFjZSBmaWVsZC1uYW1lIG11dGF0aW9uIGFzIHRoZSBsb25nLXRlcm0gYXV0aG9yaXR5IHdpdGggcmVjb3JkLXNwZWNpZmljIHN0b3JlcyB0aGF0IHJlamVjdCBtYWxmb3JtZWQgb3IgdW5zdXBwb3J0ZWQgdmVyc2lvbnMgd2l0aG91dCBvdmVyd3JpdGluZyBzb3VyY2UgYnl0ZXMuIiwKICAgICJJbXBsZW1lbnQgb25lIGlkZW1wb3RlbnQgbWlncmF0aW9uIHJvdXRpbmUgdGhhdCB2YWxpZGF0ZXMgdGhlIGxlZ2FjeSBjb21wb3NpdGUsIHJlcXVpcmVzIHJlY29nbml6ZWQgbm9uLWFjY291bnQgZmllbGRzIHRvIGJlIGNvbnN1bWVkIGJ5IHRoZWlyIG93bmluZyBtaWdyYXRpb25zIGFuZCByZWplY3RzIHVua25vd24gZmllbGRzLCBjb25zdHJ1Y3RzIGEgdmVyc2lvbmVkIHByb3ZpZGVyIHJlY29yZCBwcmVzZXJ2aW5nIHRoZSBjb21wbGV0ZSBwcm92aWRlcnMgbWFwLCB3cml0ZXMgaXQgdG8gYSAwNjAwIHRlbXBvcmFyeSBmaWxlLCBzeW5jcyBpdCwgcmUtcmVhZHMgYW5kIGRlZXAtY29tcGFyZXMgdGhlIG1hcCwgdGhlbiBhdG9taWNhbGx5IHJlcGxhY2VzIGNyZWRlbnRpYWxzLmpzb24uIiwKICAgICJEaXNjYXJkIGlzc3Vlci1sZXNzIGxlZ2FjeSB0b2tlbiwgZW1haWwsIHRpZXIsIGFuZCBleHBpcmVzX2F0IGZpZWxkcyBvbmx5IGF0IHRoZSB2ZXJpZmllZCBhdG9taWMgcmVwbGFjZW1lbnQ7IGNyZWF0ZSBubyBhY2NvdW50Lmpzb24gYW5kIHJlcG9ydCB0aGF0IGEgZnJlc2ggc3dvcm4gbG9naW4gaXMgcmVxdWlyZWQuIiwKICAgICJVc2UgdGhlIG9yaWdpbmFsIGNvbXBvc2l0ZSBhcyB0aGUgcmVjb3Zlcnkgc291cmNlIGJlZm9yZSByZXBsYWNlbWVudDsgY29udmVyZ2UgZXZlcnkgZGVjbGFyZWQgaW50ZXJydXB0aW9uIHBvaW50IGFuZCBsZWF2ZSBubyB0ZW1wb3Jhcnkgb3IgcGVybWFuZW50IHRva2VuLWJlYXJpbmcgcmVjb3ZlcnkgbWF0ZXJpYWwgYWZ0ZXIgcmVwbGFjZW1lbnQuIiwKICAgICJQcmVzZXJ2ZSBwcm92aWRlcnMsIHBlcm1pc3Npb25zLCBhbmQgY2Fub25pY2FsIHByb3ZpZGVyIGVudmlyb25tZW50IHByZWNlZGVuY2UgdGhyb3VnaG91dCBtaWdyYXRpb24gYW5kIGxhdGVyIHJlY29yZC1zcGVjaWZpYyB3cml0ZXM7IHJlcXVpcmUgUzA1IHRvIGNvbnN1bWUgbGVnYWN5IHdlYmhvb2tfdXJsIGJlZm9yZSB0aGUgcHJvdmlkZXIgcmV3cml0ZSBhbmQgZmFpbCBjbG9zZWQgb24gYW55IHVuY2xhaW1lZCBmaWVsZC4iLAogICAgIk1ha2Ugc3dvcm4gZG9jdG9yIHJlcG9ydCBhYnNlbnQsIGxlZ2FjeSwgbWlncmF0ZWQsIGNvbmZsaWN0aW5nLCBjb3JydXB0LCBhbmQgdW5zdXBwb3J0ZWQgbGF5b3V0cyB3aXRob3V0IHByaW50aW5nIGZpZWxkIHZhbHVlczsgbWFrZSBpdHMgZml4IHBhdGggY2FsbCB0aGUgc2FtZSBtaWdyYXRpb24gcm91dGluZSB1c2VkIGJ5IGFjY291bnQtYXdhcmUgY29tbWFuZHMuIiwKICAgICJLZWVwIHByb3ZpZGVyLW9ubHkgcmVhZGVycyBhbmQgY29tbWFuZHMgaW5kZXBlbmRlbnQgb2YgYWNjb3VudCBtaWdyYXRpb24gYW5kIGFjY291bnQtcmVjb3JkIHZhbGlkaXR5LiIKICBdLAogICJvdXRfb2Zfc2NvcGUiOiBbCiAgICAiRGV2aWNlIGxvZ2luLCBpc3N1ZXIgdmFsaWRhdGlvbiwgYWNjb3VudCBvdXRwdXQsIGFuZCBsb2dvdXQgZ2VzdHVyZXMgYmVsb25nIHRvIFMwMi1hdXRob3JpdGF0aXZlLWFjY291bnQtc2Vzc2lvbi4iLAogICAgIk1vZGVsIHJvdXRpbmcgYW5kIHByb3h5IHJlbW92YWwgYmVsb25nIHRvIFMwMy1kaXJlY3Qtcm91dGluZy1vbmx5LiIsCiAgICAiTGVnYWN5IHdlYmhvb2tfdXJsIG1pZ3JhdGlvbiBhbmQgbm90aWZpY2F0aW9ucy5qc29uIGJlbG9uZyB0byBTMDUtaW5kZXBlbmRlbnQtd2ViaG9vay1jb25zZW50LiIsCiAgICAiT1Mga2V5cmluZ3MsIGhhcmR3YXJlLWJhY2tlZCBzZWNyZXQgc3RvcmFnZSwgYW5kIGEgZ2VuZXJhbCBlbmNyeXB0ZWQgc3RhdGUgZGF0YWJhc2UgYXJlIG5vdCBpbnRyb2R1Y2VkLiIKICBdLAogICJjb3ZlcnNfbmVlZHMiOiBbCiAgICAiTi0wMSIsCiAgICAiTi0wOCIsCiAgICAiTi0wOSIKICBdLAogICJlZmZvcnRfY29tcGxleGl0eSI6IHsKICAgICJlZmZvcnQiOiAiaGlnaCIsCiAgICAiY29tcGxleGl0eSI6ICJoaWdoIiwKICAgICJxdWFkcmFudCI6ICJiZWFzdCIsCiAgICAicmF0aW9uYWxlIjogIlR3byBsaXZlIHNlY3JldCBmb3JtYXRzLCBjcmFzaCBvcmRlcmluZywgY29tcGF0aWJpbGl0eSwgY2FjaGUgZnJlc2huZXNzLCBwZXJtaXNzaW9ucywgYW5kIHJlY292ZXJ5IGJlaGF2aW9yIGNyZWF0ZSBhIHdpZGUgYW5kIGZhaWx1cmUtc2Vuc2l0aXZlIG1pZ3JhdGlvbiBzdXJmYWNlLiIsCiAgICAiY29uZmlybWVkX2J5X2ltcGxlbWVudGVyIjogZmFsc2UKICB9LAogICJyaXNrcyI6IFsKICAgIHsKICAgICAgImlkIjogIlItMDEiLAogICAgICAiZGVzY3JpcHRpb24iOiAiQSBjcmFzaCBkdXJpbmcgcHJvdmlkZXItcmVjb3JkIHJlcGxhY2VtZW50IGxvc2VzIGEgcHJvdmlkZXIga2V5IG9yIHN0cmFuZHMgYW4gYW1iaWd1b3VzIHRlbXBvcmFyeSByZWNvcmQuIiwKICAgICAgIm1pdGlnYXRpb24iOiAiVXNlIG5hbWVkIGtpbGwgcG9pbnRzIGJlZm9yZSB0ZW1wb3Jhcnkgd3JpdGUsIGFmdGVyIHdyaXRlLCBhZnRlciBzeW5jLCBhZnRlciByZS1yZWFkIHZlcmlmaWNhdGlvbiwgYW5kIGFmdGVyIGF0b21pYyByZW5hbWU7IGV2ZXJ5IGZpeHR1cmUgbXVzdCBjb252ZXJnZSBvbiByZXRyeSB3aXRoIHRoZSBwcm92aWRlciBtYXAgdW5jaGFuZ2VkIGFuZCBubyB1bmNsYWltZWQgZmllbGQgZGlzY2FyZGVkLiIKICAgIH0sCiAgICB7CiAgICAgICJpZCI6ICJSLTAyIiwKICAgICAgImRlc2NyaXB0aW9uIjogIkEgbWlncmF0aW9uIGJhY2t1cCBvciBxdWFyYW50aW5lIGJlY29tZXMgYSBwZXJtYW5lbnQgc2Vjb25kIGNvcHkgb2YgdGhlIGlzc3Vlci1sZXNzIGFjY291bnQgdG9rZW4uIiwKICAgICAgIm1pdGlnYXRpb24iOiAiQ3JlYXRlIG5vIGJhY2t1cCBvciBxdWFyYW50aW5lOiB0aGUgc291cmNlIGNvbXBvc2l0ZSByZW1haW5zIGF1dGhvcml0YXRpdmUgYmVmb3JlIHJlbmFtZSwgdGhlIHZlcmlmaWVkIEMtMDEgcmVjb3JkIGlzIGF1dGhvcml0YXRpdmUgYWZ0ZXIgcmVuYW1lLCBhbmQgbm8gdGVtcG9yYXJ5IGZpbGUgbWF5IHJlbWFpbiBhZnRlciBjb21wbGV0aW9uLiIKICAgIH0sCiAgICB7CiAgICAgICJpZCI6ICJSLTAzIiwKICAgICAgImRlc2NyaXB0aW9uIjogIkEgbmV3IGJpbmFyeSB3cml0ZXMgYSBwcm92aWRlciByZWNvcmQgYW4gb2xkZXIgYmluYXJ5IGNhbiBubyBsb25nZXIgcmVhZC4iLAogICAgICAibWl0aWdhdGlvbiI6ICJLZWVwIGNyZWRlbnRpYWxzLmpzb24gYW5kIHRoZSBwcm92aWRlcnMgZmllbGQgc3RhYmxlOyB2ZXJzaW9uIGlzIGFkZGl0aXZlIGFuZCBhbiBvbGQtcmVhZGVyIGNvbXBhdGliaWxpdHkgdGVzdCB1bm1hcnNoYWxzIHRoZSBtaWdyYXRlZCBwcm92aWRlciByZWNvcmQuIgogICAgfQogIF0sCiAgImFjY2VwdGFuY2VfY3JpdGVyaWEiOiBbCiAgICB7CiAgICAgICJpZCI6ICJBQy0wMSIsCiAgICAgICJ0ZXh0IjogIldIRU4gdGhlIGJ1aWx0IGJpbmFyeSBydW5zIHN3b3JuIGRvY3RvciAtLWZpeCBhZ2FpbnN0IGEgdmFsaWQgdW52ZXJzaW9uZWQgY29tcG9zaXRlIGNvbnRhaW5pbmcgb25seSBhIHByb3ZpZGVycyBtYXAsIHRva2VuLCBlbWFpbCwgdGllciwgYW5kIGV4cGlyZXNfYXQgVEhFIFNZU1RFTSBTSEFMTCBleGl0IDIsIHdyaXRlIEMtMDEgd2l0aCBtb2RlIDA2MDAsIHByZXNlcnZlIHRoZSBjb21wbGV0ZSBwcm92aWRlcnMgbWFwIGJ5IGRlZXAgZXF1YWxpdHksIG9taXQgdGhlIGZvdXIgaXNzdWVyLWxlc3MgYWNjb3VudCBmaWVsZHMsIGNyZWF0ZSBubyBhY2NvdW50Lmpzb24sIGxlYXZlIG5vIHRlbXBvcmFyeSBmaWxlLCBwcmludCBubyBmaWVsZCB2YWx1ZSwgYW5kIHN0YXRlIHRoYXQgZnJlc2ggc3dvcm4gbG9naW4gaXMgcmVxdWlyZWQgKEMtMDEsIEMtMDIsIE4tMDEsIE4tMDgpLiIsCiAgICAgICJlYXJzX3BhdHRlcm4iOiAiZXZlbnQtZHJpdmVuIiwKICAgICAgInRlc3RfcmVmcyI6IFsKICAgICAgICAiY21kL3N3b3JuL2NyZWRlbnRpYWxzX2ludGVncmF0aW9uX3Rlc3QuZ286VGVzdEFjY291bnRTcGxpdE1pZ3JhdGlvblJlYWxGaWxlc3lzdGVtIgogICAgICBdCiAgICB9LAogICAgewogICAgICAiaWQiOiAiQUMtMDIiLAogICAgICAidGV4dCI6ICJXSEVOIHRoZSBtaWdyYXRpb24gdGVzdCBob29rIHJldHVybnMgaXRzIHNlbnRpbmVsIGVycm9yIGF0IGJlZm9yZS10ZW1wLWNyZWF0ZSwgYWZ0ZXItdGVtcC13cml0ZSwgYWZ0ZXItdGVtcC1zeW5jLCBhZnRlci10ZW1wLXZlcmlmeSwgb3IgYWZ0ZXItcmVuYW1lIFRIRSBTWVNURU0gU0hBTEwsIGZvciBldmVyeSBwcmUtcmVuYW1lIGhvb2ssIGxlYXZlIGNyZWRlbnRpYWxzLmpzb24gYXQgdGhlIG9yaWdpbmFsIFNIQS0yNTYgYW5kLCBmb3IgYWZ0ZXItcmVuYW1lLCBsZWF2ZSBpdCBhdCB0aGUgdW5pbnRlcnJ1cHRlZCBtaWdyYXRpb24ncyBjYW5vbmljYWwgU0hBLTI1NjsgYWZ0ZXIgdGhlIGhvb2sgaXMgcmVtb3ZlZCwgb25lIHJldHJ5IFNIQUxMIHByb2R1Y2UgdGhhdCBjYW5vbmljYWwgU0hBLTI1Niwgbm8gYWNjb3VudC5qc29uLCBhbmQgemVybyAuY3JlZGVudGlhbHMtKi50bXAgZmlsZXMgKEMtMDEsIEMtMDIsIE4tMDEpLiIsCiAgICAgICJlYXJzX3BhdHRlcm4iOiAiZXZlbnQtZHJpdmVuIiwKICAgICAgInRlc3RfcmVmcyI6IFsKICAgICAgICAiaW50ZXJuYWwvY3JlZGVudGlhbHMvc3RvcmVfdGVzdC5nbzpUZXN0QWNjb3VudFNwbGl0TWlncmF0aW9uQ29udmVyZ2VzQWNyb3NzS2lsbFBvaW50cyIKICAgICAgXQogICAgfSwKICAgIHsKICAgICAgImlkIjogIkFDLTAzIiwKICAgICAgInRleHQiOiAiSUYgdGhlIGxlZ2FjeSBjb21wb3NpdGUgaXMgbWFsZm9ybWVkLCBDLTAxIG9yIEMtMDIgaGFzIGFuIHVuc3VwcG9ydGVkIHZlcnNpb24sIG9yIGFjY291bnQuanNvbiBhbHJlYWR5IGV4aXN0cyB3aGlsZSBsZWdhY3kgYWNjb3VudCBmaWVsZHMgcmVtYWluIFRIRU4gVEhFIFNZU1RFTSBTSEFMTCBleGl0IDEsIHByaW50IGV4YWN0bHkgb25lIG9mICdDcmVkZW50aWFsIG1pZ3JhdGlvbiBibG9ja2VkOiBtYWxmb3JtZWQgY3JlZGVudGlhbHM7IHJ1biBzd29ybiBkb2N0b3InLCAnQ3JlZGVudGlhbCBtaWdyYXRpb24gYmxvY2tlZDogdW5zdXBwb3J0ZWQgcmVjb3JkIHZlcnNpb247IHJ1biBzd29ybiBkb2N0b3InLCBvciAnQ3JlZGVudGlhbCBtaWdyYXRpb24gYmxvY2tlZDogY29uZmxpY3RpbmcgYWNjb3VudCBzdGF0ZTsgcnVuIHN3b3JuIGRvY3RvcicsIHByZXNlcnZlIFNIQS0yNTYgaGFzaGVzIG9mIGV2ZXJ5IGV